<?xml version="1.0" encoding="utf-8"?>
<asiainfo xmlns="www.asiainfo.com"
	xmlns:xsi="http://www.w3.org/2001/XMLSchema-instance"
	xsi:schemaLocation="www.asiainfo.com asia.xsd" nickName="AsiaData">
	
	<namespace>AsiaInfo</namespace>
	
	<person-info>
		<name>邬胜达</name>
		<address>岳麓区中电软件园7号栋亚信数据</address>
		<city>湖南长沙</city>
		<country>中国</country>
	</person-info>
	
	<job>
		<name>软件开发工程师</name>
		<language>Java</language>
		<work-year>2</work-year>
		<payment>1000000</payment>
	</job>
	
	<love>
		<name>编程</name>
		<introduce>用来挣钱的啊</introduce>
	</love>
	
	<love>
		<name>打代码</name>
		<introduce>用来挣钱的啊</introduce>
	</love>
	
	
</asiainfo>

